{
  "schema_version": "0.1.0",
  "dataset_id": "RBTX:S:019f8f7d-996c-7c8f-9035-1e398f9aa36f",
  "dataset_status": "candidate",
  "created_at": "2026-07-23T15:00:00Z",
  "entities": [
    {
      "entity_id": "RBTX:E:019f8f7d-9580-7deb-98bb-e62e28cbebfb",
      "kind": "organization",
      "record_status": "candidate",
      "scope_band": "enterprise"
    },
    {
      "entity_id": "RBTX:E:019f8f7d-9581-7d10-910f-f5cac5bf0692",
      "kind": "model",
      "record_status": "candidate",
      "scope_band": "system"
    },
    {
      "entity_id": "RBTX:E:019f8f7d-9582-7d5e-8844-3c2dfff0a85a",
      "kind": "model",
      "record_status": "candidate",
      "scope_band": "module"
    },
    {
      "entity_id": "RBTX:E:019f8f7d-9583-77f4-ac59-13c03c79d7b6",
      "kind": "component",
      "record_status": "candidate",
      "scope_band": "component"
    },
    {
      "entity_id": "RBTX:E:019f8f7d-9584-77df-8ce7-e47347fdb79f",
      "kind": "component",
      "record_status": "candidate",
      "scope_band": "component"
    },
    {
      "entity_id": "RBTX:E:019f8f7d-9585-73c2-9f12-924ba1f1e788",
      "kind": "family",
      "record_status": "candidate",
      "scope_band": "component"
    },
    {
      "entity_id": "RBTX:E:019f8f7d-9586-7c7e-b546-d010fbc8229d",
      "kind": "software",
      "record_status": "candidate",
      "scope_band": "module"
    },
    {
      "entity_id": "RBTX:E:019f8f7d-9587-7761-a7a8-1cd6054a4cef",
      "kind": "software",
      "record_status": "candidate",
      "scope_band": "module"
    },
    {
      "entity_id": "RBTX:E:019f8f7d-9588-7709-b78b-a1b135c09915",
      "kind": "configuration",
      "record_status": "candidate",
      "scope_band": "system"
    }
  ],
  "revisions": [
    {
      "revision_id": "RBTX:R:019f8f7d-9589-7ecd-9513-a7d3b907152d",
      "entity_id": "RBTX:E:019f8f7d-9580-7deb-98bb-e62e28cbebfb",
      "official_model_code": null,
      "official_revision_code": null,
      "regional_variant": null,
      "revision_status": "candidate",
      "lifecycle_state": "active",
      "fingerprint": "robotis-org-candidate-2026-07-23"
    },
    {
      "revision_id": "RBTX:R:019f8f7d-958a-79a8-994e-56bdc49a8d2a",
      "entity_id": "RBTX:E:019f8f7d-9581-7d10-910f-f5cac5bf0692",
      "official_model_code": "TurtleBot3 Waffle Pi",
      "official_revision_code": null,
      "regional_variant": null,
      "revision_status": "candidate",
      "lifecycle_state": "active",
      "fingerprint": "tb3-waffle-pi-revision-unfrozen"
    },
    {
      "revision_id": "RBTX:R:019f8f7d-958b-710f-b20d-d49a004b0fd8",
      "entity_id": "RBTX:E:019f8f7d-9582-7d5e-8844-3c2dfff0a85a",
      "official_model_code": "OpenMANIPULATOR-X",
      "official_revision_code": null,
      "regional_variant": null,
      "revision_status": "candidate",
      "lifecycle_state": "active",
      "fingerprint": "openmanipulator-x-revision-unfrozen"
    },
    {
      "revision_id": "RBTX:R:019f8f7d-958c-7343-a558-abf7a2315d74",
      "entity_id": "RBTX:E:019f8f7d-9583-77f4-ac59-13c03c79d7b6",
      "official_model_code": "OpenCR",
      "official_revision_code": null,
      "regional_variant": null,
      "revision_status": "candidate",
      "lifecycle_state": "unknown",
      "fingerprint": "opencr-revision-unfrozen"
    },
    {
      "revision_id": "RBTX:R:019f8f7d-958d-7df1-a7cc-00bc8b0b1fa9",
      "entity_id": "RBTX:E:019f8f7d-9584-77df-8ce7-e47347fdb79f",
      "official_model_code": "Raspberry Pi 4",
      "official_revision_code": null,
      "regional_variant": null,
      "revision_status": "candidate",
      "lifecycle_state": "unknown",
      "fingerprint": "raspberry-pi-4-memory-variant-unfrozen"
    },
    {
      "revision_id": "RBTX:R:019f8f7d-958e-7beb-aa62-998e7527d3a0",
      "entity_id": "RBTX:E:019f8f7d-9585-73c2-9f12-924ba1f1e788",
      "official_model_code": "LDS-01 or LDS-02",
      "official_revision_code": null,
      "regional_variant": null,
      "revision_status": "candidate",
      "lifecycle_state": "unknown",
      "fingerprint": "lidar-selection-unresolved"
    },
    {
      "revision_id": "RBTX:R:019f8f7d-958f-7ca3-835a-97b4a451cfdc",
      "entity_id": "RBTX:E:019f8f7d-9586-7c7e-b546-d010fbc8229d",
      "official_model_code": "ROS 2 Humble Hawksbill",
      "official_revision_code": null,
      "regional_variant": null,
      "revision_status": "candidate",
      "lifecycle_state": "unknown",
      "fingerprint": "ros2-humble-package-set-unfrozen"
    },
    {
      "revision_id": "RBTX:R:019f8f7d-9590-74d0-8c9e-4887f095f4e5",
      "entity_id": "RBTX:E:019f8f7d-9587-7761-a7a8-1cd6054a4cef",
      "official_model_code": "Ubuntu 22.04",
      "official_revision_code": null,
      "regional_variant": null,
      "revision_status": "candidate",
      "lifecycle_state": "active",
      "fingerprint": "ubuntu-22-04-patchlevel-unfrozen"
    },
    {
      "revision_id": "RBTX:R:019f8f7d-9591-765f-9ca7-03ed36820fa6",
      "entity_id": "RBTX:E:019f8f7d-9588-7709-b78b-a1b135c09915",
      "official_model_code": "RBTX mobile manipulator candidate",
      "official_revision_code": "0.1.0-candidate",
      "regional_variant": null,
      "revision_status": "candidate",
      "lifecycle_state": "unknown",
      "fingerprint": "tb3-waffle-pi-omx-candidate-v0-1-0"
    }
  ],
  "labels": [
    {
      "entity_id": "RBTX:E:019f8f7d-9580-7deb-98bb-e62e28cbebfb",
      "text": "ROBOTIS",
      "language": "en",
      "label_type": "official_international",
      "evidence_ids": [
        "RBTX:EV:019f8f7d-9592-701a-8bcc-b11e42d541ae"
      ]
    },
    {
      "entity_id": "RBTX:E:019f8f7d-9581-7d10-910f-f5cac5bf0692",
      "text": "TurtleBot3 Waffle Pi",
      "language": "en",
      "label_type": "official_international",
      "evidence_ids": [
        "RBTX:EV:019f8f7d-9592-701a-8bcc-b11e42d541ae",
        "RBTX:EV:019f8f7d-9594-7e39-8a42-80cccc977f82"
      ]
    },
    {
      "entity_id": "RBTX:E:019f8f7d-9582-7d5e-8844-3c2dfff0a85a",
      "text": "OpenMANIPULATOR-X",
      "language": "en",
      "label_type": "official_international",
      "evidence_ids": [
        "RBTX:EV:019f8f7d-9593-78dc-99d4-1e268039db1e"
      ]
    },
    {
      "entity_id": "RBTX:E:019f8f7d-9583-77f4-ac59-13c03c79d7b6",
      "text": "OpenCR",
      "language": "en",
      "label_type": "official_international",
      "evidence_ids": [
        "RBTX:EV:019f8f7d-9592-701a-8bcc-b11e42d541ae"
      ]
    },
    {
      "entity_id": "RBTX:E:019f8f7d-9584-77df-8ce7-e47347fdb79f",
      "text": "Raspberry Pi 4",
      "language": "en",
      "label_type": "official_international",
      "evidence_ids": [
        "RBTX:EV:019f8f7d-9594-7e39-8a42-80cccc977f82"
      ]
    },
    {
      "entity_id": "RBTX:E:019f8f7d-9585-73c2-9f12-924ba1f1e788",
      "text": "LDS-01 or LDS-02 selection",
      "language": "en",
      "label_type": "alias",
      "evidence_ids": [
        "RBTX:EV:019f8f7d-9592-701a-8bcc-b11e42d541ae"
      ]
    },
    {
      "entity_id": "RBTX:E:019f8f7d-9586-7c7e-b546-d010fbc8229d",
      "text": "ROS 2 Humble Hawksbill",
      "language": "en",
      "label_type": "official_international",
      "evidence_ids": [
        "RBTX:EV:019f8f7d-9592-701a-8bcc-b11e42d541ae"
      ]
    },
    {
      "entity_id": "RBTX:E:019f8f7d-9587-7761-a7a8-1cd6054a4cef",
      "text": "Ubuntu 22.04",
      "language": "en",
      "label_type": "official_international",
      "evidence_ids": [
        "RBTX:EV:019f8f7d-9592-701a-8bcc-b11e42d541ae"
      ]
    },
    {
      "entity_id": "RBTX:E:019f8f7d-9588-7709-b78b-a1b135c09915",
      "text": "TurtleBot3 Waffle Pi + OpenMANIPULATOR-X",
      "language": "en",
      "label_type": "translated",
      "evidence_ids": [
        "RBTX:EV:019f8f7d-9592-701a-8bcc-b11e42d541ae"
      ]
    }
  ],
  "evidence": [
    {
      "evidence_id": "RBTX:EV:019f8f7d-9592-701a-8bcc-b11e42d541ae",
      "evidence_class": "manufacturer_primary",
      "publisher": "ROBOTIS",
      "url": "https://emanual.robotis.com/docs/en/platform/turtlebot3/manipulation/",
      "source_date": null,
      "retrieved_at": "2026-07-23T15:00:00Z",
      "language": "en",
      "locator": "Manipulation > TurtleBot3 with OpenMANIPULATOR; Hardware Assembly; ROS 2 note",
      "response_sha256": "d0f255f3376c2dec8bb938d529824053c018f3105085ba1495c06a07dc6e77f5",
      "rights_status": "citation_permitted"
    },
    {
      "evidence_id": "RBTX:EV:019f8f7d-9593-78dc-99d4-1e268039db1e",
      "evidence_class": "manufacturer_primary",
      "publisher": "ROBOTIS",
      "url": "https://emanual.robotis.com/docs/en/platform/openmanipulator_x/specification/",
      "source_date": null,
      "retrieved_at": "2026-07-23T15:00:00Z",
      "language": "en",
      "locator": "Specification > Hardware Specification table",
      "response_sha256": "2513bc1bb2069fff8fd8ab770b28b63fb3c5b1905cfec59fbf386f991d007cf1",
      "rights_status": "citation_permitted"
    },
    {
      "evidence_id": "RBTX:EV:019f8f7d-9594-7e39-8a42-80cccc977f82",
      "evidence_class": "manufacturer_primary",
      "publisher": "ROBOTIS",
      "url": "https://emanual.robotis.com/docs/en/platform/turtlebot3/features/",
      "source_date": null,
      "retrieved_at": "2026-07-23T15:00:00Z",
      "language": "en",
      "locator": "Features > Hardware Specification table > Waffle Pi",
      "response_sha256": "66332579829aa5ac60b88b204be00a7162a7ea318b0a889f127e3a894e95ad3c",
      "rights_status": "citation_permitted"
    },
    {
      "evidence_id": "RBTX:EV:019f8f7d-9595-7cec-b493-54210abe02a5",
      "evidence_class": "manufacturer_primary",
      "publisher": "ROBOTIS-GIT",
      "url": "https://github.com/ROBOTIS-GIT/turtlebot3/releases/tag/2.3.6",
      "source_date": "2025-12-15",
      "retrieved_at": "2026-07-23T15:00:00Z",
      "language": "en",
      "locator": "Release 2.3.6",
      "response_sha256": "b3b09a7080c4c60f07831a484124020a684e6a8fe13d97001470efba4510b13a",